{
  "id": "mtgtop8-90921-890520",
  "format": "standard",
  "name": "Mono Green Aggro",
  "archetype": "Mono Green Aggro",
  "colors": [
    "C",
    "G"
  ],
  "mechanics": [],
  "collections": [
    "mono-color"
  ],
  "cardNames": [
    "Ba Sing Se",
    "Demolition Field",
    "Earthbender Ascension",
    "Escape Tunnel",
    "Esper Origins",
    "Fabled Passage",
    "Forest",
    "Icetill Explorer",
    "Keen-Eyed Curator",
    "Leatherhead, Swamp Stalker",
    "Llanowar Elves",
    "Lumbering Worldwagon",
    "Meltstrider's Resolve",
    "Mightform Harmonizer",
    "Mossborn Hydra",
    "Sapling Nursery",
    "Sazh's Chocobo",
    "Shared Roots",
    "Snakeskin Veil",
    "Surrak, Elusive Hunter",
    "Torpor Orb",
    "Warg Tactics"
  ],
  "event": "MTGO Challenge 16",
  "date": "",
  "placement": 5,
  "source": "mtgtop8",
  "sourceUrl": "https://mtgtop8.com/event?e=90921&d=890520&f=ST",
  "mainboard": [
    {
      "name": "Ba Sing Se",
      "count": 3
    },
    {
      "name": "Demolition Field",
      "count": 1
    },
    {
      "name": "Earthbender Ascension",
      "count": 4
    },
    {
      "name": "Escape Tunnel",
      "count": 4
    },
    {
      "name": "Esper Origins",
      "count": 2
    },
    {
      "name": "Fabled Passage",
      "count": 4
    },
    {
      "name": "Forest",
      "count": 13
    },
    {
      "name": "Icetill Explorer",
      "count": 4
    },
    {
      "name": "Llanowar Elves",
      "count": 4
    },
    {
      "name": "Lumbering Worldwagon",
      "count": 1
    },
    {
      "name": "Meltstrider's Resolve",
      "count": 1
    },
    {
      "name": "Mightform Harmonizer",
      "count": 4
    },
    {
      "name": "Mossborn Hydra",
      "count": 4
    },
    {
      "name": "Sapling Nursery",
      "count": 3
    },
    {
      "name": "Sazh's Chocobo",
      "count": 4
    },
    {
      "name": "Shared Roots",
      "count": 3
    },
    {
      "name": "Snakeskin Veil",
      "count": 1
    }
  ],
  "sideboard": [
    {
      "name": "Ba Sing Se",
      "count": 1
    },
    {
      "name": "Keen-Eyed Curator",
      "count": 2
    },
    {
      "name": "Leatherhead, Swamp Stalker",
      "count": 1
    },
    {
      "name": "Meltstrider's Resolve",
      "count": 3
    },
    {
      "name": "Sapling Nursery",
      "count": 1
    },
    {
      "name": "Surrak, Elusive Hunter",
      "count": 2
    },
    {
      "name": "Torpor Orb",
      "count": 3
    },
    {
      "name": "Warg Tactics",
      "count": 2
    }
  ],
  "commander": [],
  "tags": [
    "Top 8"
  ],
  "hash": "c7231c67403ad6ac",
  "manaProfile": {
    "colors": [
      "C",
      "G"
    ],
    "pipCounts": {
      "G": 44
    },
    "sourceCounts": {
      "G": 16,
      "C": 1
    },
    "landCount": 25,
    "predominantColors": [
      "G"
    ],
    "predominantLands": [
      {
        "name": "Forest",
        "count": 13
      },
      {
        "name": "Escape Tunnel",
        "count": 4
      },
      {
        "name": "Fabled Passage",
        "count": 4
      }
    ],
    "metadataCoverage": {
      "source": "local-card-artifact",
      "resolvedCardCount": 17,
      "totalCardCount": 17,
      "unresolvedCardNames": [],
      "complete": true
    }
  }
}
