{
  "id": "mtgtop8-90572-887555",
  "format": "modern",
  "name": "Mono Green Aggro",
  "archetype": "Mono Green Aggro",
  "colors": [
    "G"
  ],
  "mechanics": [],
  "collections": [
    "mono-color"
  ],
  "cardNames": [
    "Ashaya, Soul of the Wild",
    "Badgermole Cub",
    "Boseiju, Who Endures",
    "Chomping Changeling",
    "Collector Ouphe",
    "Craterhoof Behemoth",
    "Delighted Halfling",
    "Dismember",
    "Dryad Arbor",
    "Endurance",
    "Enduring Vitality",
    "Force of Vigor",
    "Forest",
    "Formidable Speaker",
    "Ghost Vacuum",
    "Green Sun's Zenith",
    "Kraul Harpooner",
    "Leyline of Abundance",
    "Lotus Cobra",
    "Misty Rainforest",
    "Nissa, Resurgent Animist",
    "Nissa, Who Shakes the World",
    "Ouroboroid",
    "Quirion Ranger",
    "Scavenging Ooze",
    "Shang-Chi, Master of Kung Fu",
    "Springheart Nantuko",
    "Summoner's Pact",
    "Ulvenwald Tracker",
    "Verdant Catacombs",
    "Vexing Bauble",
    "Webstrike Elite",
    "Windswept Heath"
  ],
  "event": "Magic Spotlight: The Hobbit� @ SCG CON Dallas",
  "date": "",
  "placement": 17,
  "source": "mtgtop8",
  "sourceUrl": "https://mtgtop8.com/event?e=90572&d=887555&f=MO",
  "mainboard": [
    {
      "name": "Ashaya, Soul of the Wild",
      "count": 1
    },
    {
      "name": "Badgermole Cub",
      "count": 4
    },
    {
      "name": "Boseiju, Who Endures",
      "count": 2
    },
    {
      "name": "Craterhoof Behemoth",
      "count": 1
    },
    {
      "name": "Delighted Halfling",
      "count": 4
    },
    {
      "name": "Dryad Arbor",
      "count": 2
    },
    {
      "name": "Enduring Vitality",
      "count": 1
    },
    {
      "name": "Forest",
      "count": 6
    },
    {
      "name": "Formidable Speaker",
      "count": 1
    },
    {
      "name": "Green Sun's Zenith",
      "count": 4
    },
    {
      "name": "Leyline of Abundance",
      "count": 4
    },
    {
      "name": "Lotus Cobra",
      "count": 1
    },
    {
      "name": "Misty Rainforest",
      "count": 4
    },
    {
      "name": "Nissa, Resurgent Animist",
      "count": 1
    },
    {
      "name": "Nissa, Who Shakes the World",
      "count": 1
    },
    {
      "name": "Ouroboroid",
      "count": 4
    },
    {
      "name": "Quirion Ranger",
      "count": 4
    },
    {
      "name": "Shang-Chi, Master of Kung Fu",
      "count": 3
    },
    {
      "name": "Springheart Nantuko",
      "count": 4
    },
    {
      "name": "Summoner's Pact",
      "count": 3
    },
    {
      "name": "Verdant Catacombs",
      "count": 4
    },
    {
      "name": "Windswept Heath",
      "count": 1
    }
  ],
  "sideboard": [
    {
      "name": "Chomping Changeling",
      "count": 1
    },
    {
      "name": "Collector Ouphe",
      "count": 1
    },
    {
      "name": "Dismember",
      "count": 3
    },
    {
      "name": "Endurance",
      "count": 1
    },
    {
      "name": "Force of Vigor",
      "count": 1
    },
    {
      "name": "Ghost Vacuum",
      "count": 1
    },
    {
      "name": "Kraul Harpooner",
      "count": 1
    },
    {
      "name": "Scavenging Ooze",
      "count": 1
    },
    {
      "name": "Ulvenwald Tracker",
      "count": 1
    },
    {
      "name": "Vexing Bauble",
      "count": 3
    },
    {
      "name": "Webstrike Elite",
      "count": 1
    }
  ],
  "commander": [],
  "tags": [],
  "hash": "f9fc665a1ed18162",
  "manaProfile": {
    "colors": [
      "G"
    ],
    "pipCounts": {
      "G": 51
    },
    "sourceCounts": {
      "G": 10
    },
    "landCount": 19,
    "predominantColors": [
      "G"
    ],
    "predominantLands": [
      {
        "name": "Forest",
        "count": 6
      },
      {
        "name": "Misty Rainforest",
        "count": 4
      },
      {
        "name": "Verdant Catacombs",
        "count": 4
      }
    ],
    "metadataCoverage": {
      "source": "local-card-artifact+scryfall",
      "resolvedCardCount": 22,
      "totalCardCount": 22,
      "unresolvedCardNames": [],
      "complete": true
    }
  }
}
