{
  "id": "mtgtop8-90808-889599",
  "format": "modern",
  "name": "Broodscale Bloodchief",
  "archetype": "Broodscale Bloodchief",
  "colors": [
    "B",
    "C",
    "G"
  ],
  "mechanics": [],
  "cardNames": [
    "Ancient Stirrings",
    "Basking Broodscale",
    "Blade of the Bloodchief",
    "Boseiju, Who Endures",
    "Cavern of Souls",
    "Devourer of Destiny",
    "Dismember",
    "Eldrazi Temple",
    "Emrakul, the Promised End",
    "Forest",
    "Gemstone Caverns",
    "Glaring Fleshraker",
    "Grafdigger's Cage",
    "Haywire Mite",
    "Kozilek's Command",
    "Malevolent Rumble",
    "Nature's Claim",
    "Pithing Needle",
    "Run Afoul",
    "Shifting Woodland",
    "Sire of Seven Deaths",
    "Six",
    "Soul-Guide Lantern",
    "Sowing Mycospawn",
    "Springleaf Drum",
    "Thief of Existence",
    "Trinisphere",
    "Ugin's Labyrinth",
    "Urza's Saga",
    "Vexing Bauble",
    "Warping Wail",
    "Yavimaya, Cradle of Growth"
  ],
  "event": "$uper $unday ReCQ 10:00am @ SCG CON Baltimore",
  "date": "",
  "placement": 9,
  "source": "mtgtop8",
  "sourceUrl": "https://mtgtop8.com/event?e=90808&d=889599&f=MO",
  "mainboard": [
    {
      "name": "Ancient Stirrings",
      "count": 4
    },
    {
      "name": "Basking Broodscale",
      "count": 4
    },
    {
      "name": "Blade of the Bloodchief",
      "count": 3
    },
    {
      "name": "Boseiju, Who Endures",
      "count": 2
    },
    {
      "name": "Cavern of Souls",
      "count": 1
    },
    {
      "name": "Devourer of Destiny",
      "count": 2
    },
    {
      "name": "Dismember",
      "count": 2
    },
    {
      "name": "Eldrazi Temple",
      "count": 4
    },
    {
      "name": "Emrakul, the Promised End",
      "count": 4
    },
    {
      "name": "Forest",
      "count": 6
    },
    {
      "name": "Gemstone Caverns",
      "count": 1
    },
    {
      "name": "Glaring Fleshraker",
      "count": 2
    },
    {
      "name": "Haywire Mite",
      "count": 1
    },
    {
      "name": "Kozilek's Command",
      "count": 4
    },
    {
      "name": "Malevolent Rumble",
      "count": 4
    },
    {
      "name": "Shifting Woodland",
      "count": 1
    },
    {
      "name": "Soul-Guide Lantern",
      "count": 1
    },
    {
      "name": "Sowing Mycospawn",
      "count": 4
    },
    {
      "name": "Springleaf Drum",
      "count": 1
    },
    {
      "name": "Ugin's Labyrinth",
      "count": 3
    },
    {
      "name": "Urza's Saga",
      "count": 4
    },
    {
      "name": "Vexing Bauble",
      "count": 1
    },
    {
      "name": "Yavimaya, Cradle of Growth",
      "count": 1
    }
  ],
  "sideboard": [
    {
      "name": "Dismember",
      "count": 1
    },
    {
      "name": "Grafdigger's Cage",
      "count": 2
    },
    {
      "name": "Nature's Claim",
      "count": 2
    },
    {
      "name": "Pithing Needle",
      "count": 1
    },
    {
      "name": "Run Afoul",
      "count": 1
    },
    {
      "name": "Sire of Seven Deaths",
      "count": 1
    },
    {
      "name": "Six",
      "count": 1
    },
    {
      "name": "Thief of Existence",
      "count": 1
    },
    {
      "name": "Trinisphere",
      "count": 2
    },
    {
      "name": "Vexing Bauble",
      "count": 2
    },
    {
      "name": "Warping Wail",
      "count": 1
    }
  ],
  "commander": [],
  "tags": [],
  "hash": "e34bc463d1e70262",
  "manaProfile": {
    "colors": [
      "B",
      "C",
      "G"
    ],
    "pipCounts": {
      "G": 16,
      "C": 14,
      "B": 4
    },
    "sourceCounts": {
      "G": 10,
      "C": 11
    },
    "landCount": 23,
    "predominantColors": [
      "C"
    ],
    "predominantLands": [
      {
        "name": "Forest",
        "count": 6
      },
      {
        "name": "Eldrazi Temple",
        "count": 4
      },
      {
        "name": "Urza's Saga",
        "count": 4
      }
    ],
    "metadataCoverage": {
      "source": "local-card-artifact",
      "resolvedCardCount": 23,
      "totalCardCount": 23,
      "unresolvedCardNames": [],
      "complete": true
    }
  }
}
