{
  "id": "mtgtop8-90964-890807",
  "format": "modern",
  "name": "Hollow One",
  "archetype": "Hollow One",
  "colors": [
    "B",
    "G",
    "R",
    "W"
  ],
  "mechanics": [],
  "collections": [
    "last-20-events"
  ],
  "cardNames": [
    "Arena of Glory",
    "Arid Mesa",
    "Blazing Rootwalla",
    "Bloodstained Mire",
    "Burning Inquiry",
    "Damping Sphere",
    "Deafening Silence",
    "Detective's Phoenix",
    "Elegant Parlor",
    "Faithless Looting",
    "Hardened Academic",
    "Hollow One",
    "Lightning Bolt",
    "Marauding Mako",
    "Mountain",
    "Obsidian Charmaw",
    "Practiced Offense",
    "Prismatic Ending",
    "Rough / Tumble",
    "Sacred Foundry",
    "Scalding Tarn",
    "Soul-Guide Lantern",
    "Street Wraith",
    "Surgical Extraction",
    "Vengevine",
    "Vexing Bauble",
    "Wear / Tear",
    "Wooded Foothills"
  ],
  "event": "MTGO League",
  "date": "2026-09-17",
  "placement": 2,
  "source": "mtgtop8",
  "sourceUrl": "https://mtgtop8.com/event?e=90964&d=890807&f=MO",
  "mainboard": [
    {
      "name": "Arena of Glory",
      "count": 1
    },
    {
      "name": "Arid Mesa",
      "count": 1
    },
    {
      "name": "Blazing Rootwalla",
      "count": 4
    },
    {
      "name": "Bloodstained Mire",
      "count": 3
    },
    {
      "name": "Burning Inquiry",
      "count": 4
    },
    {
      "name": "Detective's Phoenix",
      "count": 4
    },
    {
      "name": "Elegant Parlor",
      "count": 1
    },
    {
      "name": "Faithless Looting",
      "count": 4
    },
    {
      "name": "Hardened Academic",
      "count": 4
    },
    {
      "name": "Hollow One",
      "count": 4
    },
    {
      "name": "Lightning Bolt",
      "count": 4
    },
    {
      "name": "Marauding Mako",
      "count": 4
    },
    {
      "name": "Mountain",
      "count": 2
    },
    {
      "name": "Practiced Offense",
      "count": 2
    },
    {
      "name": "Sacred Foundry",
      "count": 4
    },
    {
      "name": "Scalding Tarn",
      "count": 4
    },
    {
      "name": "Street Wraith",
      "count": 4
    },
    {
      "name": "Vengevine",
      "count": 4
    },
    {
      "name": "Wooded Foothills",
      "count": 2
    }
  ],
  "sideboard": [
    {
      "name": "Damping Sphere",
      "count": 2
    },
    {
      "name": "Deafening Silence",
      "count": 1
    },
    {
      "name": "Obsidian Charmaw",
      "count": 1
    },
    {
      "name": "Prismatic Ending",
      "count": 1
    },
    {
      "name": "Rough / Tumble",
      "count": 2
    },
    {
      "name": "Soul-Guide Lantern",
      "count": 1
    },
    {
      "name": "Surgical Extraction",
      "count": 3
    },
    {
      "name": "Vexing Bauble",
      "count": 2
    },
    {
      "name": "Wear / Tear",
      "count": 2
    }
  ],
  "commander": [],
  "tags": [
    "Top 8"
  ],
  "hash": "8bbd9a2b018fe58e",
  "manaProfile": {
    "colors": [
      "B",
      "G",
      "R",
      "W"
    ],
    "pipCounts": {
      "R": 28,
      "W": 6,
      "B": 8,
      "G": 8
    },
    "sourceCounts": {
      "R": 8,
      "W": 5
    },
    "landCount": 18,
    "predominantColors": [
      "R"
    ],
    "predominantLands": [
      {
        "name": "Sacred Foundry",
        "count": 4
      },
      {
        "name": "Scalding Tarn",
        "count": 4
      },
      {
        "name": "Bloodstained Mire",
        "count": 3
      }
    ],
    "metadataCoverage": {
      "source": "local-card-artifact+scryfall",
      "resolvedCardCount": 19,
      "totalCardCount": 19,
      "unresolvedCardNames": [],
      "complete": true
    }
  }
}
