{
  "id": "mtgtop8-90842-889872",
  "format": "standard",
  "name": "Jund Aggro",
  "archetype": "Jund Aggro",
  "colors": [
    "B",
    "G",
    "R"
  ],
  "mechanics": [],
  "collections": [
    "last-major-events"
  ],
  "cardNames": [
    "Biotech Specialist",
    "Blazemire Verge",
    "Blooming Marsh",
    "Callous Inspector",
    "Deadly Precision",
    "Duress",
    "Forest",
    "Gene Pollinator",
    "Goldvein Hydra",
    "Greedy Freebooter",
    "Lively Dirge",
    "Mutagen Man, Living Ooze",
    "Obsessive Pursuit",
    "Overgrown Tomb",
    "Phoenix Fleet Airship",
    "Professor Dellian Fel",
    "Rottenmouth Viper",
    "Shoot the Sheriff",
    "Starting Town",
    "Stomping Ground",
    "Strategic Betrayal",
    "Surrak, Elusive Hunter",
    "Swamp",
    "The Ooze",
    "The Sackville-Bagginses",
    "Tragic Trajectory",
    "Umbral Collar Zealot",
    "Urgent Necropsy",
    "Vicious Rivalry"
  ],
  "event": "Champions Cup Premium Qualifier @ TC (Tokyo, Japan)",
  "date": "2026-09-12",
  "placement": 1,
  "source": "mtgtop8",
  "sourceUrl": "https://mtgtop8.com/event?e=90842&d=889872&f=ST",
  "mainboard": [
    {
      "name": "Biotech Specialist",
      "count": 4
    },
    {
      "name": "Blazemire Verge",
      "count": 3
    },
    {
      "name": "Blooming Marsh",
      "count": 4
    },
    {
      "name": "Callous Inspector",
      "count": 2
    },
    {
      "name": "Deadly Precision",
      "count": 3
    },
    {
      "name": "Forest",
      "count": 1
    },
    {
      "name": "Gene Pollinator",
      "count": 4
    },
    {
      "name": "Goldvein Hydra",
      "count": 1
    },
    {
      "name": "Greedy Freebooter",
      "count": 4
    },
    {
      "name": "Lively Dirge",
      "count": 4
    },
    {
      "name": "Mutagen Man, Living Ooze",
      "count": 2
    },
    {
      "name": "Obsessive Pursuit",
      "count": 4
    },
    {
      "name": "Overgrown Tomb",
      "count": 4
    },
    {
      "name": "Rottenmouth Viper",
      "count": 1
    },
    {
      "name": "Starting Town",
      "count": 4
    },
    {
      "name": "Stomping Ground",
      "count": 3
    },
    {
      "name": "Swamp",
      "count": 2
    },
    {
      "name": "The Sackville-Bagginses",
      "count": 4
    },
    {
      "name": "Tragic Trajectory",
      "count": 2
    },
    {
      "name": "Umbral Collar Zealot",
      "count": 4
    }
  ],
  "sideboard": [
    {
      "name": "Duress",
      "count": 3
    },
    {
      "name": "Phoenix Fleet Airship",
      "count": 1
    },
    {
      "name": "Professor Dellian Fel",
      "count": 1
    },
    {
      "name": "Shoot the Sheriff",
      "count": 2
    },
    {
      "name": "Strategic Betrayal",
      "count": 3
    },
    {
      "name": "Surrak, Elusive Hunter",
      "count": 2
    },
    {
      "name": "The Ooze",
      "count": 1
    },
    {
      "name": "Urgent Necropsy",
      "count": 1
    },
    {
      "name": "Vicious Rivalry",
      "count": 1
    }
  ],
  "commander": [],
  "tags": [
    "Top 8"
  ],
  "hash": "e50488fb52c84eda",
  "manaProfile": {
    "colors": [
      "B",
      "G",
      "R"
    ],
    "pipCounts": {
      "R": 4,
      "G": 13,
      "B": 28
    },
    "sourceCounts": {
      "B": 13,
      "R": 6,
      "G": 12
    },
    "landCount": 21,
    "predominantColors": [
      "B"
    ],
    "predominantLands": [
      {
        "name": "Blooming Marsh",
        "count": 4
      },
      {
        "name": "Overgrown Tomb",
        "count": 4
      },
      {
        "name": "Starting Town",
        "count": 4
      }
    ],
    "metadataCoverage": {
      "source": "local-card-artifact",
      "resolvedCardCount": 20,
      "totalCardCount": 20,
      "unresolvedCardNames": [],
      "complete": true
    }
  }
}
