{
  "id": "mtgtop8-90808-889593",
  "format": "modern",
  "name": "Pinnacle Affinity",
  "archetype": "Pinnacle Affinity",
  "colors": [
    "C",
    "R",
    "U",
    "W"
  ],
  "mechanics": [],
  "collections": [
    "last-major-events"
  ],
  "cardNames": [
    "Consign to Memory",
    "Damping Sphere",
    "Dispatch",
    "Emry, Lurker of the Loch",
    "Flame of Anor",
    "Flooded Strand",
    "Grafdigger's Cage",
    "Grinding Station",
    "Hallowed Fountain",
    "Harbinger of the Seas",
    "Island",
    "Kappa Cannoneer",
    "Krang, Master Mind",
    "Metallic Rebuke",
    "Mishra's Bauble",
    "Mox Amber",
    "Mox Opal",
    "Oswald Fiddlebender",
    "Otawara, Soaring City",
    "Pinnacle Emissary",
    "Pithing Needle",
    "Portable Hole",
    "Seachrome Coast",
    "Sewer-veillance Cam",
    "Shadowspear",
    "Skateboard",
    "Steam Vents",
    "Swan Song",
    "Tamiyo, Inquisitive Student",
    "Tormod's Crypt",
    "Urza's Saga",
    "Vexing Bauble",
    "Welding Jar"
  ],
  "event": "$uper $unday ReCQ 10:00am @ SCG CON Baltimore",
  "date": "2026-09-13",
  "placement": 5,
  "source": "mtgtop8",
  "sourceUrl": "https://mtgtop8.com/event?e=90808&d=889593&f=MO",
  "mainboard": [
    {
      "name": "Emry, Lurker of the Loch",
      "count": 4
    },
    {
      "name": "Flooded Strand",
      "count": 3
    },
    {
      "name": "Grinding Station",
      "count": 1
    },
    {
      "name": "Hallowed Fountain",
      "count": 2
    },
    {
      "name": "Island",
      "count": 2
    },
    {
      "name": "Kappa Cannoneer",
      "count": 4
    },
    {
      "name": "Krang, Master Mind",
      "count": 1
    },
    {
      "name": "Mishra's Bauble",
      "count": 4
    },
    {
      "name": "Mox Amber",
      "count": 3
    },
    {
      "name": "Mox Opal",
      "count": 4
    },
    {
      "name": "Oswald Fiddlebender",
      "count": 1
    },
    {
      "name": "Otawara, Soaring City",
      "count": 1
    },
    {
      "name": "Pinnacle Emissary",
      "count": 4
    },
    {
      "name": "Pithing Needle",
      "count": 1
    },
    {
      "name": "Portable Hole",
      "count": 3
    },
    {
      "name": "Seachrome Coast",
      "count": 4
    },
    {
      "name": "Sewer-veillance Cam",
      "count": 2
    },
    {
      "name": "Skateboard",
      "count": 1
    },
    {
      "name": "Steam Vents",
      "count": 1
    },
    {
      "name": "Tamiyo, Inquisitive Student",
      "count": 3
    },
    {
      "name": "Tormod's Crypt",
      "count": 4
    },
    {
      "name": "Urza's Saga",
      "count": 4
    },
    {
      "name": "Welding Jar",
      "count": 3
    }
  ],
  "sideboard": [
    {
      "name": "Consign to Memory",
      "count": 3
    },
    {
      "name": "Damping Sphere",
      "count": 1
    },
    {
      "name": "Dispatch",
      "count": 1
    },
    {
      "name": "Flame of Anor",
      "count": 1
    },
    {
      "name": "Grafdigger's Cage",
      "count": 1
    },
    {
      "name": "Harbinger of the Seas",
      "count": 2
    },
    {
      "name": "Metallic Rebuke",
      "count": 2
    },
    {
      "name": "Portable Hole",
      "count": 1
    },
    {
      "name": "Shadowspear",
      "count": 1
    },
    {
      "name": "Swan Song",
      "count": 1
    },
    {
      "name": "Vexing Bauble",
      "count": 1
    }
  ],
  "commander": [],
  "tags": [
    "Top 8"
  ],
  "hash": "c05198598a17c06c",
  "manaProfile": {
    "colors": [
      "C",
      "R",
      "U",
      "W"
    ],
    "pipCounts": {
      "U": 16,
      "W": 4,
      "R": 4
    },
    "sourceCounts": {
      "U": 10,
      "W": 6,
      "R": 1,
      "C": 4
    },
    "landCount": 17,
    "predominantColors": [
      "U"
    ],
    "predominantLands": [
      {
        "name": "Seachrome Coast",
        "count": 4
      },
      {
        "name": "Urza's Saga",
        "count": 4
      },
      {
        "name": "Flooded Strand",
        "count": 3
      }
    ],
    "metadataCoverage": {
      "source": "local-card-artifact",
      "resolvedCardCount": 23,
      "totalCardCount": 23,
      "unresolvedCardNames": [],
      "complete": true
    }
  }
}
