{
  "id": "mtgtop8-90964-890811",
  "format": "modern",
  "name": "UrzaTron",
  "archetype": "UrzaTron",
  "colors": [
    "B",
    "C",
    "G"
  ],
  "mechanics": [],
  "collections": [
    "last-20-events"
  ],
  "cardNames": [
    "All Is Dust",
    "Chalice of the Void",
    "Cityscape Leveler",
    "Cursed Totem",
    "Devourer of Destiny",
    "Dismember",
    "Disruptor Flute",
    "Eldrazi Temple",
    "Emrakul, the Aeons Torn",
    "Emrakul, the Promised End",
    "Ensnaring Bridge",
    "Expedition Map",
    "Extinguisher Battleship",
    "Forest",
    "Giant's Boulder",
    "Grafdigger's Cage",
    "Haywire Mite",
    "Karn, the Great Creator",
    "Kozilek's Command",
    "Liquimetal Coating",
    "Sowing Mycospawn",
    "Talisman of Resilience",
    "The Filigree Sylex",
    "The Stone Brain",
    "Tormod's Crypt",
    "Torpor Orb",
    "Trinisphere",
    "Ugin's Labyrinth",
    "Ugin, Eye of the Storms",
    "Ulamog, the Ceaseless Hunger",
    "Urza's Mine",
    "Urza's Power Plant",
    "Urza's Tower",
    "Vexing Bauble",
    "Walking Ballista"
  ],
  "event": "MTGO League",
  "date": "2026-09-17",
  "placement": 6,
  "source": "mtgtop8",
  "sourceUrl": "https://mtgtop8.com/event?e=90964&d=890811&f=MO",
  "mainboard": [
    {
      "name": "All Is Dust",
      "count": 1
    },
    {
      "name": "Chalice of the Void",
      "count": 2
    },
    {
      "name": "Devourer of Destiny",
      "count": 3
    },
    {
      "name": "Dismember",
      "count": 2
    },
    {
      "name": "Eldrazi Temple",
      "count": 3
    },
    {
      "name": "Emrakul, the Aeons Torn",
      "count": 1
    },
    {
      "name": "Emrakul, the Promised End",
      "count": 1
    },
    {
      "name": "Expedition Map",
      "count": 4
    },
    {
      "name": "Forest",
      "count": 2
    },
    {
      "name": "Giant's Boulder",
      "count": 3
    },
    {
      "name": "Karn, the Great Creator",
      "count": 4
    },
    {
      "name": "Kozilek's Command",
      "count": 4
    },
    {
      "name": "Sowing Mycospawn",
      "count": 4
    },
    {
      "name": "Talisman of Resilience",
      "count": 4
    },
    {
      "name": "Trinisphere",
      "count": 1
    },
    {
      "name": "Ugin, Eye of the Storms",
      "count": 3
    },
    {
      "name": "Ugin's Labyrinth",
      "count": 4
    },
    {
      "name": "Ulamog, the Ceaseless Hunger",
      "count": 1
    },
    {
      "name": "Urza's Mine",
      "count": 4
    },
    {
      "name": "Urza's Power Plant",
      "count": 4
    },
    {
      "name": "Urza's Tower",
      "count": 4
    },
    {
      "name": "Vexing Bauble",
      "count": 1
    }
  ],
  "sideboard": [
    {
      "name": "All Is Dust",
      "count": 1
    },
    {
      "name": "Cityscape Leveler",
      "count": 1
    },
    {
      "name": "Cursed Totem",
      "count": 1
    },
    {
      "name": "Disruptor Flute",
      "count": 1
    },
    {
      "name": "Ensnaring Bridge",
      "count": 1
    },
    {
      "name": "Extinguisher Battleship",
      "count": 1
    },
    {
      "name": "Grafdigger's Cage",
      "count": 1
    },
    {
      "name": "Haywire Mite",
      "count": 1
    },
    {
      "name": "Liquimetal Coating",
      "count": 1
    },
    {
      "name": "The Filigree Sylex",
      "count": 1
    },
    {
      "name": "The Stone Brain",
      "count": 1
    },
    {
      "name": "Tormod's Crypt",
      "count": 1
    },
    {
      "name": "Torpor Orb",
      "count": 1
    },
    {
      "name": "Trinisphere",
      "count": 1
    },
    {
      "name": "Walking Ballista",
      "count": 1
    }
  ],
  "commander": [],
  "tags": [
    "Top 8"
  ],
  "hash": "7927a7a3ac89ed17",
  "manaProfile": {
    "colors": [
      "B",
      "C",
      "G"
    ],
    "pipCounts": {
      "C": 14,
      "B": 4,
      "G": 4
    },
    "sourceCounts": {
      "C": 19,
      "G": 2
    },
    "landCount": 21,
    "predominantColors": [
      "C"
    ],
    "predominantLands": [
      {
        "name": "Ugin's Labyrinth",
        "count": 4
      },
      {
        "name": "Urza's Mine",
        "count": 4
      },
      {
        "name": "Urza's Power Plant",
        "count": 4
      }
    ],
    "metadataCoverage": {
      "source": "local-card-artifact",
      "resolvedCardCount": 22,
      "totalCardCount": 22,
      "unresolvedCardNames": [],
      "complete": true
    }
  }
}
