{
  "id": "mtgtop8-90842-889877",
  "format": "standard",
  "name": "Izzet Spellementals",
  "archetype": "Izzet Spellementals",
  "colors": [
    "R",
    "U"
  ],
  "mechanics": [],
  "collections": [
    "last-major-events"
  ],
  "cardNames": [
    "Abrade",
    "Annul",
    "Burst Lightning",
    "Colorstorm Stallion",
    "Disdainful Stroke",
    "Eddymurk Crab",
    "Fire Magic",
    "Flashfreeze",
    "Get Out",
    "Hearth Elemental",
    "Impractical Joke",
    "Island",
    "Multiversal Passage",
    "Opt",
    "Prismari Charm",
    "Riverpyre Verge",
    "Sear",
    "Sleight of Hand",
    "Spell Pierce",
    "Spell Snare",
    "Spirebluff Canal",
    "Steam Vents",
    "Sunderflock",
    "Traumatic Critique",
    "Wan Shi Tong, Librarian",
    "Winternight Stories"
  ],
  "event": "Champions Cup Premium Qualifier @ TC (Tokyo, Japan)",
  "date": "2026-09-12",
  "placement": 5,
  "source": "mtgtop8",
  "sourceUrl": "https://mtgtop8.com/event?e=90842&d=889877&f=ST",
  "mainboard": [
    {
      "name": "Burst Lightning",
      "count": 3
    },
    {
      "name": "Eddymurk Crab",
      "count": 4
    },
    {
      "name": "Get Out",
      "count": 3
    },
    {
      "name": "Hearth Elemental",
      "count": 4
    },
    {
      "name": "Impractical Joke",
      "count": 1
    },
    {
      "name": "Island",
      "count": 6
    },
    {
      "name": "Multiversal Passage",
      "count": 2
    },
    {
      "name": "Opt",
      "count": 4
    },
    {
      "name": "Prismari Charm",
      "count": 4
    },
    {
      "name": "Riverpyre Verge",
      "count": 4
    },
    {
      "name": "Sleight of Hand",
      "count": 4
    },
    {
      "name": "Spell Pierce",
      "count": 1
    },
    {
      "name": "Spell Snare",
      "count": 2
    },
    {
      "name": "Spirebluff Canal",
      "count": 4
    },
    {
      "name": "Steam Vents",
      "count": 4
    },
    {
      "name": "Sunderflock",
      "count": 4
    },
    {
      "name": "Traumatic Critique",
      "count": 4
    },
    {
      "name": "Winternight Stories",
      "count": 2
    }
  ],
  "sideboard": [
    {
      "name": "Abrade",
      "count": 1
    },
    {
      "name": "Annul",
      "count": 1
    },
    {
      "name": "Colorstorm Stallion",
      "count": 4
    },
    {
      "name": "Disdainful Stroke",
      "count": 2
    },
    {
      "name": "Fire Magic",
      "count": 2
    },
    {
      "name": "Flashfreeze",
      "count": 1
    },
    {
      "name": "Sear",
      "count": 1
    },
    {
      "name": "Spell Snare",
      "count": 2
    },
    {
      "name": "Wan Shi Tong, Librarian",
      "count": 1
    }
  ],
  "commander": [],
  "tags": [
    "Top 8"
  ],
  "hash": "c10ba80ce2c38334",
  "manaProfile": {
    "colors": [
      "R",
      "U"
    ],
    "pipCounts": {
      "R": 20,
      "U": 43
    },
    "sourceCounts": {
      "U": 18,
      "R": 12
    },
    "landCount": 20,
    "predominantColors": [
      "U"
    ],
    "predominantLands": [
      {
        "name": "Island",
        "count": 6
      },
      {
        "name": "Riverpyre Verge",
        "count": 4
      },
      {
        "name": "Spirebluff Canal",
        "count": 4
      }
    ],
    "metadataCoverage": {
      "source": "local-card-artifact",
      "resolvedCardCount": 18,
      "totalCardCount": 18,
      "unresolvedCardNames": [],
      "complete": true
    }
  }
}
