{
  "id": "mtgtop8-90928-890574",
  "format": "pioneer",
  "name": "Retraction Helix",
  "archetype": "Retraction Helix",
  "colors": [
    "B",
    "U"
  ],
  "mechanics": [],
  "collections": [
    "last-20-events"
  ],
  "cardNames": [
    "Boomerang Basics",
    "Clearwater Pathway",
    "Darkslick Shores",
    "Dig Through Time",
    "Ghost Vacuum",
    "Gloomlake Verge",
    "Gran-Gran",
    "Grim Bauble",
    "Island",
    "Mox Amber",
    "Narset, Parter of Veils",
    "Requiting Hex",
    "Retraction Helix",
    "Rona, Herald of Invasion",
    "Sewer-veillance Cam",
    "Spell Pierce",
    "Stock Up",
    "Stormchaser's Talent",
    "Thassa's Oracle",
    "Thundertrap Trainer",
    "Valley Floodcaller",
    "Watery Grave"
  ],
  "event": "MTGO League",
  "date": "2026-09-16",
  "placement": 2,
  "source": "mtgtop8",
  "sourceUrl": "https://mtgtop8.com/event?e=90928&d=890574&f=PI",
  "mainboard": [
    {
      "name": "Boomerang Basics",
      "count": 4
    },
    {
      "name": "Clearwater Pathway",
      "count": 4
    },
    {
      "name": "Darkslick Shores",
      "count": 4
    },
    {
      "name": "Gloomlake Verge",
      "count": 4
    },
    {
      "name": "Gran-Gran",
      "count": 4
    },
    {
      "name": "Island",
      "count": 5
    },
    {
      "name": "Mox Amber",
      "count": 4
    },
    {
      "name": "Retraction Helix",
      "count": 4
    },
    {
      "name": "Rona, Herald of Invasion",
      "count": 4
    },
    {
      "name": "Sewer-veillance Cam",
      "count": 3
    },
    {
      "name": "Stock Up",
      "count": 4
    },
    {
      "name": "Stormchaser's Talent",
      "count": 4
    },
    {
      "name": "Thassa's Oracle",
      "count": 1
    },
    {
      "name": "Thundertrap Trainer",
      "count": 4
    },
    {
      "name": "Valley Floodcaller",
      "count": 3
    },
    {
      "name": "Watery Grave",
      "count": 4
    }
  ],
  "sideboard": [
    {
      "name": "Dig Through Time",
      "count": 1
    },
    {
      "name": "Ghost Vacuum",
      "count": 2
    },
    {
      "name": "Grim Bauble",
      "count": 4
    },
    {
      "name": "Narset, Parter of Veils",
      "count": 3
    },
    {
      "name": "Requiting Hex",
      "count": 3
    },
    {
      "name": "Spell Pierce",
      "count": 2
    }
  ],
  "commander": [],
  "tags": [
    "Top 8"
  ],
  "hash": "ae1982e4d7783ad7",
  "manaProfile": {
    "colors": [
      "B",
      "U"
    ],
    "pipCounts": {
      "U": 32
    },
    "sourceCounts": {
      "B": 16,
      "U": 21
    },
    "landCount": 21,
    "predominantColors": [
      "U"
    ],
    "predominantLands": [
      {
        "name": "Island",
        "count": 5
      },
      {
        "name": "Clearwater Pathway",
        "count": 4
      },
      {
        "name": "Darkslick Shores",
        "count": 4
      }
    ],
    "metadataCoverage": {
      "source": "local-card-artifact",
      "resolvedCardCount": 16,
      "totalCardCount": 16,
      "unresolvedCardNames": [],
      "complete": true
    }
  }
}
