{
  "id": "mtgtop8-90974-890873",
  "format": "modern",
  "name": "Esper Blink",
  "archetype": "Esper Blink",
  "colors": [
    "B",
    "U",
    "W"
  ],
  "mechanics": [],
  "collections": [
    "last-20-events"
  ],
  "cardNames": [
    "Boggart Trawler",
    "Clarion Conqueror",
    "Consign to Memory",
    "Emperor of Bones",
    "Ephemerate",
    "Fatal Push",
    "Flickerwisp",
    "Flooded Strand",
    "Godless Shrine",
    "Hallowed Fountain",
    "High Noon",
    "Marsh Flats",
    "Meticulous Archive",
    "Nihil Spellbomb",
    "Overlord of the Balemurk",
    "Phelia, Exuberant Shepherd",
    "Plains",
    "Polluted Delta",
    "Prismatic Ending",
    "Quantum Riddler",
    "Shadowy Backstreet",
    "Solitude",
    "Swamp",
    "Teferi, Time Raveler",
    "Thoughtseize",
    "Undercity Sewers",
    "Watery Grave",
    "White Orchid Phantom",
    "Witch Enchanter",
    "Wrath of the Skies"
  ],
  "event": "3� Etapa CLM @ Mont CardShop (Campinas, Brazil)",
  "date": "2026-09-17",
  "placement": 3,
  "source": "mtgtop8",
  "sourceUrl": "https://mtgtop8.com/event?e=90974&d=890873&f=MO",
  "mainboard": [
    {
      "name": "Boggart Trawler",
      "count": 1
    },
    {
      "name": "Emperor of Bones",
      "count": 3
    },
    {
      "name": "Ephemerate",
      "count": 3
    },
    {
      "name": "Fatal Push",
      "count": 4
    },
    {
      "name": "Flickerwisp",
      "count": 3
    },
    {
      "name": "Flooded Strand",
      "count": 4
    },
    {
      "name": "Godless Shrine",
      "count": 2
    },
    {
      "name": "Hallowed Fountain",
      "count": 1
    },
    {
      "name": "Marsh Flats",
      "count": 4
    },
    {
      "name": "Meticulous Archive",
      "count": 1
    },
    {
      "name": "Overlord of the Balemurk",
      "count": 4
    },
    {
      "name": "Phelia, Exuberant Shepherd",
      "count": 4
    },
    {
      "name": "Plains",
      "count": 2
    },
    {
      "name": "Polluted Delta",
      "count": 1
    },
    {
      "name": "Prismatic Ending",
      "count": 1
    },
    {
      "name": "Quantum Riddler",
      "count": 4
    },
    {
      "name": "Shadowy Backstreet",
      "count": 1
    },
    {
      "name": "Solitude",
      "count": 4
    },
    {
      "name": "Swamp",
      "count": 1
    },
    {
      "name": "Teferi, Time Raveler",
      "count": 2
    },
    {
      "name": "Thoughtseize",
      "count": 4
    },
    {
      "name": "Undercity Sewers",
      "count": 1
    },
    {
      "name": "Watery Grave",
      "count": 1
    },
    {
      "name": "Witch Enchanter",
      "count": 4
    }
  ],
  "sideboard": [
    {
      "name": "Clarion Conqueror",
      "count": 2
    },
    {
      "name": "Consign to Memory",
      "count": 3
    },
    {
      "name": "High Noon",
      "count": 2
    },
    {
      "name": "Nihil Spellbomb",
      "count": 2
    },
    {
      "name": "White Orchid Phantom",
      "count": 3
    },
    {
      "name": "Wrath of the Skies",
      "count": 3
    }
  ],
  "commander": [],
  "tags": [
    "Top 8"
  ],
  "hash": "930a04ee3e45e68b",
  "manaProfile": {
    "colors": [
      "B",
      "U",
      "W"
    ],
    "pipCounts": {
      "B": 19,
      "W": 24,
      "U": 10
    },
    "sourceCounts": {
      "B": 6,
      "W": 7,
      "U": 4
    },
    "landCount": 19,
    "predominantColors": [
      "W"
    ],
    "predominantLands": [
      {
        "name": "Flooded Strand",
        "count": 4
      },
      {
        "name": "Marsh Flats",
        "count": 4
      },
      {
        "name": "Godless Shrine",
        "count": 2
      }
    ],
    "metadataCoverage": {
      "source": "local-card-artifact",
      "resolvedCardCount": 24,
      "totalCardCount": 24,
      "unresolvedCardNames": [],
      "complete": true
    }
  }
}
