{
  "id": "mtgtop8-90808-889609",
  "format": "modern",
  "name": "Dimir Control",
  "archetype": "Dimir Control",
  "colors": [
    "B",
    "U"
  ],
  "mechanics": [],
  "cardNames": [
    "Bloodstained Mire",
    "Cling to Dust",
    "Consign to Memory",
    "Counterspell",
    "Darkslick Shores",
    "Drown in the Loch",
    "Engineered Explosives",
    "Fatal Push",
    "Flooded Strand",
    "Force of Negation",
    "Gloomlake Verge",
    "Harbinger of the Seas",
    "Island",
    "Kaito, Bane of Nightmares",
    "Murktide Regent",
    "Mystical Dispute",
    "Nihil Spellbomb",
    "Orcish Bowmasters",
    "Otawara, Soaring City",
    "Polluted Delta",
    "Preordain",
    "Psychic Frog",
    "Quantum Riddler",
    "Sheoldred's Edict",
    "Sink into Stupor",
    "Spell Pierce",
    "Spell Snare",
    "Stern Scolding",
    "Swamp",
    "Tamiyo, Inquisitive Student",
    "Tasigur, the Golden Fang",
    "Thoughtseize",
    "Toxic Deluge",
    "Undercity Sewers",
    "Watery Grave"
  ],
  "event": "$uper $unday ReCQ 10:00am @ SCG CON Baltimore",
  "date": "",
  "placement": 17,
  "source": "mtgtop8",
  "sourceUrl": "https://mtgtop8.com/event?e=90808&d=889609&f=MO",
  "mainboard": [
    {
      "name": "Bloodstained Mire",
      "count": 2
    },
    {
      "name": "Cling to Dust",
      "count": 1
    },
    {
      "name": "Counterspell",
      "count": 3
    },
    {
      "name": "Darkslick Shores",
      "count": 1
    },
    {
      "name": "Drown in the Loch",
      "count": 1
    },
    {
      "name": "Fatal Push",
      "count": 4
    },
    {
      "name": "Flooded Strand",
      "count": 3
    },
    {
      "name": "Force of Negation",
      "count": 3
    },
    {
      "name": "Gloomlake Verge",
      "count": 1
    },
    {
      "name": "Island",
      "count": 3
    },
    {
      "name": "Kaito, Bane of Nightmares",
      "count": 1
    },
    {
      "name": "Murktide Regent",
      "count": 2
    },
    {
      "name": "Orcish Bowmasters",
      "count": 3
    },
    {
      "name": "Otawara, Soaring City",
      "count": 1
    },
    {
      "name": "Polluted Delta",
      "count": 4
    },
    {
      "name": "Preordain",
      "count": 3
    },
    {
      "name": "Psychic Frog",
      "count": 4
    },
    {
      "name": "Quantum Riddler",
      "count": 2
    },
    {
      "name": "Sheoldred's Edict",
      "count": 2
    },
    {
      "name": "Sink into Stupor",
      "count": 1
    },
    {
      "name": "Spell Pierce",
      "count": 1
    },
    {
      "name": "Spell Snare",
      "count": 3
    },
    {
      "name": "Swamp",
      "count": 1
    },
    {
      "name": "Tamiyo, Inquisitive Student",
      "count": 2
    },
    {
      "name": "Tasigur, the Golden Fang",
      "count": 1
    },
    {
      "name": "Thoughtseize",
      "count": 3
    },
    {
      "name": "Undercity Sewers",
      "count": 2
    },
    {
      "name": "Watery Grave",
      "count": 2
    }
  ],
  "sideboard": [
    {
      "name": "Consign to Memory",
      "count": 4
    },
    {
      "name": "Engineered Explosives",
      "count": 2
    },
    {
      "name": "Harbinger of the Seas",
      "count": 2
    },
    {
      "name": "Kaito, Bane of Nightmares",
      "count": 1
    },
    {
      "name": "Mystical Dispute",
      "count": 2
    },
    {
      "name": "Nihil Spellbomb",
      "count": 2
    },
    {
      "name": "Stern Scolding",
      "count": 1
    },
    {
      "name": "Toxic Deluge",
      "count": 1
    }
  ],
  "commander": [],
  "tags": [],
  "hash": "35bcbb6157257618",
  "manaProfile": {
    "colors": [
      "B",
      "U"
    ],
    "pipCounts": {
      "B": 20,
      "U": 33
    },
    "sourceCounts": {
      "B": 7,
      "U": 10
    },
    "landCount": 20,
    "predominantColors": [
      "U"
    ],
    "predominantLands": [
      {
        "name": "Polluted Delta",
        "count": 4
      },
      {
        "name": "Flooded Strand",
        "count": 3
      },
      {
        "name": "Island",
        "count": 3
      }
    ],
    "metadataCoverage": {
      "source": "local-card-artifact",
      "resolvedCardCount": 28,
      "totalCardCount": 28,
      "unresolvedCardNames": [],
      "complete": true
    }
  }
}
