{
  "id": "mtgtop8-90964-890806",
  "format": "modern",
  "name": "Devoted Combo",
  "archetype": "Devoted Combo",
  "colors": [
    "B",
    "G",
    "W"
  ],
  "mechanics": [],
  "collections": [
    "last-20-events"
  ],
  "cardNames": [
    "Abrupt Decay",
    "Agatha's Soul Cauldron",
    "Badgermole Cub",
    "Birds of Paradise",
    "Boseiju, Who Endures",
    "Craterhoof Behemoth",
    "Crystal Barricade",
    "Delighted Halfling",
    "Devoted Druid",
    "Doorkeeper Thrull",
    "Dryad Arbor",
    "Duskwatch Recruiter",
    "Endurance",
    "Fiend Artisan",
    "Forest",
    "Gemstone Caverns",
    "Green Sun's Zenith",
    "Grist, the Hunger Tide",
    "Guerrilla Gorilla",
    "Horizon Canopy",
    "Icetill Explorer",
    "Keen-Eyed Curator",
    "Kraul Harpooner",
    "Leyline of Abundance",
    "Misty Rainforest",
    "Nature's Rhythm",
    "Nurturing Peatland",
    "Ouroboroid",
    "Overgrown Tomb",
    "Pick Your Poison",
    "Postmortem Lunge",
    "Reclamation Sage",
    "Shang-Chi, Master of Kung Fu",
    "Temple Garden",
    "Thoughtseize",
    "Tyvar, Jubilant Brawler",
    "Tyvar, the Pummeler",
    "Underground Mortuary",
    "Verdant Catacombs",
    "Vizier of Remedies",
    "Windswept Heath",
    "Wooded Foothills"
  ],
  "event": "MTGO League",
  "date": "2026-09-17",
  "placement": 1,
  "source": "mtgtop8",
  "sourceUrl": "https://mtgtop8.com/event?e=90964&d=890806&f=MO",
  "mainboard": [
    {
      "name": "Agatha's Soul Cauldron",
      "count": 1
    },
    {
      "name": "Badgermole Cub",
      "count": 4
    },
    {
      "name": "Birds of Paradise",
      "count": 2
    },
    {
      "name": "Boseiju, Who Endures",
      "count": 2
    },
    {
      "name": "Craterhoof Behemoth",
      "count": 1
    },
    {
      "name": "Delighted Halfling",
      "count": 4
    },
    {
      "name": "Devoted Druid",
      "count": 4
    },
    {
      "name": "Dryad Arbor",
      "count": 2
    },
    {
      "name": "Duskwatch Recruiter",
      "count": 1
    },
    {
      "name": "Fiend Artisan",
      "count": 1
    },
    {
      "name": "Forest",
      "count": 2
    },
    {
      "name": "Gemstone Caverns",
      "count": 1
    },
    {
      "name": "Green Sun's Zenith",
      "count": 4
    },
    {
      "name": "Horizon Canopy",
      "count": 1
    },
    {
      "name": "Leyline of Abundance",
      "count": 4
    },
    {
      "name": "Misty Rainforest",
      "count": 1
    },
    {
      "name": "Nature's Rhythm",
      "count": 4
    },
    {
      "name": "Nurturing Peatland",
      "count": 1
    },
    {
      "name": "Ouroboroid",
      "count": 1
    },
    {
      "name": "Overgrown Tomb",
      "count": 2
    },
    {
      "name": "Postmortem Lunge",
      "count": 1
    },
    {
      "name": "Shang-Chi, Master of Kung Fu",
      "count": 1
    },
    {
      "name": "Temple Garden",
      "count": 1
    },
    {
      "name": "Tyvar, Jubilant Brawler",
      "count": 4
    },
    {
      "name": "Tyvar, the Pummeler",
      "count": 1
    },
    {
      "name": "Underground Mortuary",
      "count": 1
    },
    {
      "name": "Verdant Catacombs",
      "count": 2
    },
    {
      "name": "Vizier of Remedies",
      "count": 1
    },
    {
      "name": "Windswept Heath",
      "count": 3
    },
    {
      "name": "Wooded Foothills",
      "count": 2
    }
  ],
  "sideboard": [
    {
      "name": "Abrupt Decay",
      "count": 2
    },
    {
      "name": "Crystal Barricade",
      "count": 2
    },
    {
      "name": "Doorkeeper Thrull",
      "count": 1
    },
    {
      "name": "Endurance",
      "count": 1
    },
    {
      "name": "Grist, the Hunger Tide",
      "count": 1
    },
    {
      "name": "Guerrilla Gorilla",
      "count": 1
    },
    {
      "name": "Icetill Explorer",
      "count": 1
    },
    {
      "name": "Keen-Eyed Curator",
      "count": 1
    },
    {
      "name": "Kraul Harpooner",
      "count": 1
    },
    {
      "name": "Pick Your Poison",
      "count": 1
    },
    {
      "name": "Reclamation Sage",
      "count": 1
    },
    {
      "name": "Thoughtseize",
      "count": 2
    }
  ],
  "commander": [],
  "tags": [
    "Top 8"
  ],
  "hash": "7ca1b50124443795",
  "manaProfile": {
    "colors": [
      "B",
      "G",
      "W"
    ],
    "pipCounts": {
      "G": 48,
      "B": 7,
      "W": 1
    },
    "sourceCounts": {
      "G": 12,
      "W": 2,
      "B": 4
    },
    "landCount": 21,
    "predominantColors": [
      "G"
    ],
    "predominantLands": [
      {
        "name": "Windswept Heath",
        "count": 3
      },
      {
        "name": "Boseiju, Who Endures",
        "count": 2
      },
      {
        "name": "Dryad Arbor",
        "count": 2
      }
    ],
    "metadataCoverage": {
      "source": "local-card-artifact+scryfall",
      "resolvedCardCount": 30,
      "totalCardCount": 30,
      "unresolvedCardNames": [],
      "complete": true
    }
  }
}
