{
  "id": "mtgtop8-88835-874295",
  "format": "modern",
  "name": "Mono Green Aggro",
  "archetype": "Mono Green Aggro",
  "colors": [
    "G"
  ],
  "mechanics": [],
  "collections": [
    "mono-color"
  ],
  "cardNames": [
    "Ashaya, Soul of the Wild",
    "Badgermole Cub",
    "Chomping Changeling",
    "Collector Ouphe",
    "Craterhoof Behemoth",
    "Delighted Halfling",
    "Disciple of Freyalise",
    "Dismember",
    "Dryad Arbor",
    "Eladamri, Korvecdal",
    "Endurance",
    "Enduring Vitality",
    "Forest",
    "Green Sun's Zenith",
    "Ignoble Hierarch",
    "Leyline of Abundance",
    "Lotus Cobra",
    "Misty Rainforest",
    "Nature's Rhythm",
    "Nissa, Resurgent Animist",
    "Ouroboroid",
    "Quirion Ranger",
    "Scavenging Ooze",
    "Shang-Chi, Master of Kung Fu",
    "Soulless Jailer",
    "Springheart Nantuko",
    "Summoner's Pact",
    "Tajuru Preserver",
    "Trinisphere",
    "Verdant Catacombs",
    "Windswept Heath"
  ],
  "event": "MTGO Challenge 64",
  "date": "",
  "placement": 1,
  "source": "mtgtop8",
  "sourceUrl": "https://mtgtop8.com/event?e=88835&d=874295&f=MO",
  "mainboard": [
    {
      "name": "Ashaya, Soul of the Wild",
      "count": 1
    },
    {
      "name": "Badgermole Cub",
      "count": 4
    },
    {
      "name": "Craterhoof Behemoth",
      "count": 1
    },
    {
      "name": "Delighted Halfling",
      "count": 4
    },
    {
      "name": "Disciple of Freyalise",
      "count": 1
    },
    {
      "name": "Dryad Arbor",
      "count": 2
    },
    {
      "name": "Eladamri, Korvecdal",
      "count": 1
    },
    {
      "name": "Enduring Vitality",
      "count": 1
    },
    {
      "name": "Forest",
      "count": 7
    },
    {
      "name": "Green Sun's Zenith",
      "count": 4
    },
    {
      "name": "Ignoble Hierarch",
      "count": 1
    },
    {
      "name": "Leyline of Abundance",
      "count": 4
    },
    {
      "name": "Lotus Cobra",
      "count": 1
    },
    {
      "name": "Misty Rainforest",
      "count": 4
    },
    {
      "name": "Nature's Rhythm",
      "count": 2
    },
    {
      "name": "Nissa, Resurgent Animist",
      "count": 1
    },
    {
      "name": "Ouroboroid",
      "count": 1
    },
    {
      "name": "Quirion Ranger",
      "count": 4
    },
    {
      "name": "Shang-Chi, Master of Kung Fu",
      "count": 3
    },
    {
      "name": "Springheart Nantuko",
      "count": 4
    },
    {
      "name": "Summoner's Pact",
      "count": 4
    },
    {
      "name": "Verdant Catacombs",
      "count": 1
    },
    {
      "name": "Windswept Heath",
      "count": 4
    }
  ],
  "sideboard": [
    {
      "name": "Chomping Changeling",
      "count": 1
    },
    {
      "name": "Collector Ouphe",
      "count": 1
    },
    {
      "name": "Dismember",
      "count": 2
    },
    {
      "name": "Endurance",
      "count": 1
    },
    {
      "name": "Ouroboroid",
      "count": 3
    },
    {
      "name": "Scavenging Ooze",
      "count": 1
    },
    {
      "name": "Soulless Jailer",
      "count": 2
    },
    {
      "name": "Tajuru Preserver",
      "count": 1
    },
    {
      "name": "Trinisphere",
      "count": 3
    }
  ],
  "commander": [],
  "tags": [
    "Top 8"
  ],
  "hash": "68a459ae0f16711a",
  "manaProfile": {
    "colors": [
      "G"
    ],
    "pipCounts": {
      "G": 49
    },
    "sourceCounts": {
      "G": 9
    },
    "landCount": 18,
    "predominantColors": [
      "G"
    ],
    "predominantLands": [
      {
        "name": "Forest",
        "count": 7
      },
      {
        "name": "Misty Rainforest",
        "count": 4
      },
      {
        "name": "Windswept Heath",
        "count": 4
      }
    ],
    "metadataCoverage": {
      "source": "local-card-artifact+scryfall",
      "resolvedCardCount": 23,
      "totalCardCount": 23,
      "unresolvedCardNames": [],
      "complete": true
    }
  }
}
