{
  "id": "mtgtop8-90808-889590",
  "format": "modern",
  "name": "UrzaTron",
  "archetype": "UrzaTron",
  "colors": [],
  "mechanics": [],
  "cardNames": [
    "All Is Dust",
    "Chalice of the Void",
    "Devourer of Destiny",
    "Dismember",
    "Disruptor Flute",
    "Eldrazi Temple",
    "Engineered Explosives",
    "Ensnaring Bridge",
    "Expedition Map",
    "Extinguisher Battleship",
    "Forest",
    "Haywire Mite",
    "Karn, the Great Creator",
    "Kozilek's Command",
    "Liquimetal Coating",
    "Relic of Progenitus",
    "Sire of Seven Deaths",
    "Soulless Jailer",
    "Sowing Mycospawn",
    "Talisman of Impulse",
    "Talisman of Resilience",
    "The Stone Brain",
    "Thought-Knot Seer",
    "Tormod's Crypt",
    "Torpor Orb",
    "Trinisphere",
    "Ugin's Labyrinth",
    "Ugin, Eye of the Storms",
    "Ulamog, the Ceaseless Hunger",
    "Urza's Mine",
    "Urza's Power Plant",
    "Urza's Tower",
    "Vexing Bauble",
    "Walking Ballista",
    "Wastes"
  ],
  "event": "$uper $unday ReCQ 10:00am @ SCG CON Baltimore",
  "date": "",
  "placement": 3,
  "source": "mtgtop8",
  "sourceUrl": "https://mtgtop8.com/event?e=90808&d=889590&f=MO",
  "mainboard": [
    {
      "name": "All Is Dust",
      "count": 1
    },
    {
      "name": "Chalice of the Void",
      "count": 2
    },
    {
      "name": "Devourer of Destiny",
      "count": 3
    },
    {
      "name": "Dismember",
      "count": 2
    },
    {
      "name": "Eldrazi Temple",
      "count": 4
    },
    {
      "name": "Expedition Map",
      "count": 4
    },
    {
      "name": "Forest",
      "count": 1
    },
    {
      "name": "Karn, the Great Creator",
      "count": 4
    },
    {
      "name": "Kozilek's Command",
      "count": 4
    },
    {
      "name": "Relic of Progenitus",
      "count": 1
    },
    {
      "name": "Sire of Seven Deaths",
      "count": 1
    },
    {
      "name": "Sowing Mycospawn",
      "count": 4
    },
    {
      "name": "Talisman of Impulse",
      "count": 2
    },
    {
      "name": "Talisman of Resilience",
      "count": 2
    },
    {
      "name": "Thought-Knot Seer",
      "count": 3
    },
    {
      "name": "Ugin, Eye of the Storms",
      "count": 4
    },
    {
      "name": "Ugin's Labyrinth",
      "count": 4
    },
    {
      "name": "Ulamog, the Ceaseless Hunger",
      "count": 1
    },
    {
      "name": "Urza's Mine",
      "count": 4
    },
    {
      "name": "Urza's Power Plant",
      "count": 4
    },
    {
      "name": "Urza's Tower",
      "count": 4
    },
    {
      "name": "Wastes",
      "count": 1
    }
  ],
  "sideboard": [
    {
      "name": "Disruptor Flute",
      "count": 3
    },
    {
      "name": "Engineered Explosives",
      "count": 1
    },
    {
      "name": "Ensnaring Bridge",
      "count": 1
    },
    {
      "name": "Extinguisher Battleship",
      "count": 1
    },
    {
      "name": "Haywire Mite",
      "count": 1
    },
    {
      "name": "Liquimetal Coating",
      "count": 1
    },
    {
      "name": "Soulless Jailer",
      "count": 1
    },
    {
      "name": "The Stone Brain",
      "count": 1
    },
    {
      "name": "Tormod's Crypt",
      "count": 1
    },
    {
      "name": "Torpor Orb",
      "count": 1
    },
    {
      "name": "Trinisphere",
      "count": 1
    },
    {
      "name": "Vexing Bauble",
      "count": 1
    },
    {
      "name": "Walking Ballista",
      "count": 1
    }
  ],
  "commander": [],
  "tags": [
    "Top 8"
  ],
  "hash": "83eecd7e3035e02b"
}
