{
  "id": "mtgtop8-90952-890714",
  "format": "standard",
  "name": "Mardu Aggro",
  "archetype": "Mardu Aggro",
  "colors": [
    "B",
    "R",
    "W"
  ],
  "mechanics": [],
  "collections": [
    "last-20-events"
  ],
  "cardNames": [
    "Blood Crypt",
    "Bloodghast",
    "Case of the Crimson Pulse",
    "Casey Jones, Vigilante",
    "Cecil, Dark Knight",
    "Concealed Courtyard",
    "Cool but Rude",
    "Day of Judgment",
    "Erode",
    "Godless Shrine",
    "Hardened Academic",
    "Inspiring Vantage",
    "Inti, Seneschal of the Sun",
    "Iron-Shield Elf",
    "Marauding Mako",
    "Monument to Endurance",
    "Moonshadow",
    "Mountain",
    "Multiversal Passage",
    "Practiced Offense",
    "Requisition Raid",
    "Requiting Hex",
    "Sacred Foundry",
    "Sheltered by Ghosts",
    "Shoot the Sheriff",
    "Starting Town",
    "Strategic Betrayal",
    "Swamp",
    "Tersa Lightshatter"
  ],
  "event": "MTGO Challenge 16",
  "date": "2026-09-17",
  "placement": 3,
  "source": "mtgtop8",
  "sourceUrl": "https://mtgtop8.com/event?e=90952&d=890714&f=ST",
  "mainboard": [
    {
      "name": "Blood Crypt",
      "count": 4
    },
    {
      "name": "Bloodghast",
      "count": 4
    },
    {
      "name": "Casey Jones, Vigilante",
      "count": 1
    },
    {
      "name": "Cecil, Dark Knight",
      "count": 2
    },
    {
      "name": "Concealed Courtyard",
      "count": 3
    },
    {
      "name": "Cool but Rude",
      "count": 4
    },
    {
      "name": "Erode",
      "count": 2
    },
    {
      "name": "Godless Shrine",
      "count": 3
    },
    {
      "name": "Hardened Academic",
      "count": 4
    },
    {
      "name": "Inspiring Vantage",
      "count": 2
    },
    {
      "name": "Inti, Seneschal of the Sun",
      "count": 1
    },
    {
      "name": "Iron-Shield Elf",
      "count": 4
    },
    {
      "name": "Marauding Mako",
      "count": 4
    },
    {
      "name": "Moonshadow",
      "count": 4
    },
    {
      "name": "Mountain",
      "count": 1
    },
    {
      "name": "Multiversal Passage",
      "count": 1
    },
    {
      "name": "Practiced Offense",
      "count": 4
    },
    {
      "name": "Requiting Hex",
      "count": 2
    },
    {
      "name": "Sacred Foundry",
      "count": 4
    },
    {
      "name": "Starting Town",
      "count": 3
    },
    {
      "name": "Swamp",
      "count": 1
    },
    {
      "name": "Tersa Lightshatter",
      "count": 2
    }
  ],
  "sideboard": [
    {
      "name": "Case of the Crimson Pulse",
      "count": 1
    },
    {
      "name": "Day of Judgment",
      "count": 2
    },
    {
      "name": "Monument to Endurance",
      "count": 3
    },
    {
      "name": "Requisition Raid",
      "count": 1
    },
    {
      "name": "Sheltered by Ghosts",
      "count": 3
    },
    {
      "name": "Shoot the Sheriff",
      "count": 2
    },
    {
      "name": "Strategic Betrayal",
      "count": 3
    }
  ],
  "commander": [],
  "tags": [
    "Top 8"
  ],
  "hash": "550d73bbcdb0e643",
  "manaProfile": {
    "colors": [
      "B",
      "R",
      "W"
    ],
    "pipCounts": {
      "B": 18,
      "R": 17,
      "W": 10
    },
    "sourceCounts": {
      "B": 11,
      "R": 11,
      "W": 12
    },
    "landCount": 22,
    "predominantColors": [
      "W"
    ],
    "predominantLands": [
      {
        "name": "Blood Crypt",
        "count": 4
      },
      {
        "name": "Sacred Foundry",
        "count": 4
      },
      {
        "name": "Concealed Courtyard",
        "count": 3
      }
    ],
    "metadataCoverage": {
      "source": "local-card-artifact",
      "resolvedCardCount": 22,
      "totalCardCount": 22,
      "unresolvedCardNames": [],
      "complete": true
    }
  }
}
